{
  "server": {
    "host": "127.0.0.1",
    "port": 3080,
    "autoStart": true
  },
  "model": {
    "provider": "deepseek-official",
    "model": "deepseek-v4-flash",
    "apiKey": "",
    "baseURL": ""
  },
  "paths": {
    "dataDir": "",
    "logDir": ""
  },
  "advanced": {
    "extraEnv": {},
    "logLevel": "info"
  },
  "ui": {
    "theme": "system"
  },
  "updates": {
    "channel": "stable"
  }
}
